{
  "$schema": "https://json-schema.org/draft/2020-12/schema",
  "$id": "https://raw.githubusercontent.com/Qudits-Labs/factory-core/main/schemas/ac-map.schema.json",
  "title": "Zuordnung Akzeptanzkriterium zu Testfall",
  "description": "Diese Datei liegt im Produktrepositorium, üblicherweise unter `tests/ac-map.yml`. Der Kern legt nur ihren Aufbau fest. Sie beantwortet die Frage, welcher Testfall welches Akzeptanzkriterium prüft, und macht damit den maschinellen Teil der Abdeckungsprüfung möglich. Ob ein Testfall die genannte Bedingung tatsächlich trifft, entscheidet die Prüfung durch einen Agenten, nicht diese Datei.",
  "type": "array",
  "minItems": 1,
  "items": {
    "type": "object",
    "additionalProperties": false,
    "required": ["criterion_id", "tc_ids", "condition"],
    "properties": {
      "criterion_id": {
        "type": "string",
        "minLength": 1,
        "description": "Kennung des Akzeptanzkriteriums, wie sie im Issue steht."
      },
      "tc_ids": {
        "type": "array",
        "minItems": 1,
        "items": { "type": "string", "minLength": 1 },
        "description": "Kennungen der Testfälle, die dieses Kriterium prüfen. Mindestens einer."
      },
      "condition": {
        "type": "string",
        "minLength": 5,
        "description": "Der Wortlaut der Bedingung aus dem Issue. Er steht hier, damit die Prüfung Kriterium und Testfall gegenüberstellen kann, ohne das Issue erneut zu lesen."
      },
      "test_files": {
        "type": "array",
        "items": { "type": "string" },
        "description": "Dateien, in denen die genannten Testfälle liegen. Freiwillig; erleichtert die Fehlersuche."
      },
      "manual": {
        "type": "boolean",
        "default": false,
        "description": "Wahr, wenn das Kriterium nicht automatisiert prüfbar ist und der Testfall aus einem manuellen Testplan stammt. Ein manueller Fall taucht in keiner Testausgabe auf und wird deshalb bei der Suche nach fehlenden Kennungen übersprungen."
      }
    }
  }
}
